{
  "schema": "radar-monitor/v1",
  "generated_at": "2026-09-21T22:03:33.329037+00:00",
  "run": {
    "run_id": "run-20260921T220047Z-68b13e9e",
    "status": "success",
    "started_at": "2026-09-21T22:00:47.396870+00:00",
    "finished_at": "2026-09-21T22:03:32.258053+00:00",
    "duration_ms": 164861,
    "trigger_request_id": null,
    "report_path": "/data/radar-run-report.json"
  },
  "summary": {
    "modules": 84,
    "sources": 31,
    "enabled_sources": 29,
    "healthy_sources": 29,
    "failed_sources": 0,
    "baseline_verified": 29,
    "baseline_pending": 0,
    "updated": 0,
    "translated": 0
  },
  "providers": [
    {
      "id": "deepseek",
      "name": "DeepSeek",
      "configured": true,
      "model": "deepseek-chat",
      "base_url": "https://api.deepseek.com",
      "status": "configured",
      "success_count": 0,
      "failure_count": 0,
      "fallback_count": 0
    },
    {
      "id": "google",
      "name": "Google Translate",
      "configured": true,
      "model": "google-translate-gtx",
      "base_url": "https://translate.googleapis.com/translate_a/single",
      "status": "configured",
      "success_count": 0,
      "failure_count": 0,
      "fallback_count": 0
    }
  ],
  "modules": [
    {
      "module_id": "docs.a2a",
      "name": "A2A Protocol",
      "kind": "source",
      "enabled": true,
      "target_path": null,
      "status": "pending",
      "task_ids": [
        "task.docs.a2a.sync"
      ],
      "source_ids": [
        "docs.a2a"
      ],
      "updated": 0,
      "translated": 0,
      "translation_links": [],
      "errors": []
    },
    {
      "module_id": "docs.anthropic-skills",
      "name": "Anthropic Skills",
      "kind": "source",
      "enabled": true,
      "target_path": null,
      "status": "pending",
      "task_ids": [
        "task.docs.anthropic-skills.sync"
      ],
      "source_ids": [
        "docs.anthropic-skills"
      ],
      "updated": 0,
      "translated": 0,
      "translation_links": [],
      "errors": []
    },
    {
      "module_id": "docs.autogen",
      "name": "AutoGen / AG2",
      "kind": "source",
      "enabled": true,
      "target_path": null,
      "status": "pending",
      "task_ids": [
        "task.docs.autogen.sync"
      ],
      "source_ids": [
        "docs.autogen"
      ],
      "updated": 0,
      "translated": 0,
      "translation_links": [],
      "errors": []
    },
    {
      "module_id": "docs.chroma",
      "name": "Chroma",
      "kind": "source",
      "enabled": true,
      "target_path": null,
      "status": "pending",
      "task_ids": [
        "task.docs.chroma.sync"
      ],
      "source_ids": [
        "docs.chroma"
      ],
      "updated": 0,
      "translated": 0,
      "translation_links": [],
      "errors": []
    },
    {
      "module_id": "docs.codex",
      "name": "Codex",
      "kind": "source",
      "enabled": true,
      "target_path": null,
      "status": "pending",
      "task_ids": [
        "task.docs.codex.sync"
      ],
      "source_ids": [
        "docs.codex"
      ],
      "updated": 0,
      "translated": 0,
      "translation_links": [],
      "errors": []
    },
    {
      "module_id": "docs.codex-sdk",
      "name": "Codex SDK",
      "kind": "source",
      "enabled": true,
      "target_path": null,
      "status": "pending",
      "task_ids": [
        "task.docs.codex-sdk.sync"
      ],
      "source_ids": [
        "docs.codex-sdk"
      ],
      "updated": 0,
      "translated": 0,
      "translation_links": [],
      "errors": []
    },
    {
      "module_id": "docs.crewai",
      "name": "CrewAI",
      "kind": "source",
      "enabled": true,
      "target_path": null,
      "status": "pending",
      "task_ids": [
        "task.docs.crewai.sync"
      ],
      "source_ids": [
        "docs.crewai"
      ],
      "updated": 0,
      "translated": 0,
      "translation_links": [],
      "errors": []
    },
    {
      "module_id": "docs.cursor",
      "name": "Cursor",
      "kind": "source",
      "enabled": true,
      "target_path": null,
      "status": "pending",
      "task_ids": [
        "task.docs.cursor.sync"
      ],
      "source_ids": [
        "docs.cursor"
      ],
      "updated": 0,
      "translated": 0,
      "translation_links": [],
      "errors": []
    },
    {
      "module_id": "docs.deepeval",
      "name": "DeepEval",
      "kind": "source",
      "enabled": true,
      "target_path": null,
      "status": "pending",
      "task_ids": [
        "task.docs.deepeval.sync"
      ],
      "source_ids": [
        "docs.deepeval"
      ],
      "updated": 0,
      "translated": 0,
      "translation_links": [],
      "errors": []
    },
    {
      "module_id": "docs.dspy",
      "name": "DSPy",
      "kind": "source",
      "enabled": true,
      "target_path": null,
      "status": "pending",
      "task_ids": [
        "task.docs.dspy.sync"
      ],
      "source_ids": [
        "docs.dspy"
      ],
      "updated": 0,
      "translated": 0,
      "translation_links": [],
      "errors": []
    },
    {
      "module_id": "docs.faiss",
      "name": "FAISS",
      "kind": "source",
      "enabled": true,
      "target_path": null,
      "status": "pending",
      "task_ids": [
        "task.docs.faiss.sync"
      ],
      "source_ids": [
        "docs.faiss"
      ],
      "updated": 0,
      "translated": 0,
      "translation_links": [],
      "errors": []
    },
    {
      "module_id": "docs.fastmcp",
      "name": "FastMCP",
      "kind": "source",
      "enabled": true,
      "target_path": null,
      "status": "pending",
      "task_ids": [
        "task.docs.fastmcp.sync"
      ],
      "source_ids": [
        "docs.fastmcp"
      ],
      "updated": 0,
      "translated": 0,
      "translation_links": [],
      "errors": []
    },
    {
      "module_id": "docs.guardrails-ai",
      "name": "Guardrails AI",
      "kind": "source",
      "enabled": true,
      "target_path": null,
      "status": "pending",
      "task_ids": [
        "task.docs.guardrails-ai.sync"
      ],
      "source_ids": [
        "docs.guardrails-ai"
      ],
      "updated": 0,
      "translated": 0,
      "translation_links": [],
      "errors": []
    },
    {
      "module_id": "docs.guidance",
      "name": "Guidance",
      "kind": "source",
      "enabled": true,
      "target_path": null,
      "status": "pending",
      "task_ids": [
        "task.docs.guidance.sync"
      ],
      "source_ids": [
        "docs.guidance"
      ],
      "updated": 0,
      "translated": 0,
      "translation_links": [],
      "errors": []
    },
    {
      "module_id": "docs.humanlayer",
      "name": "HumanLayer",
      "kind": "source",
      "enabled": true,
      "target_path": null,
      "status": "pending",
      "task_ids": [
        "task.docs.humanlayer.sync"
      ],
      "source_ids": [
        "docs.humanlayer"
      ],
      "updated": 0,
      "translated": 0,
      "translation_links": [],
      "errors": []
    },
    {
      "module_id": "docs.instructor",
      "name": "Instructor",
      "kind": "source",
      "enabled": true,
      "target_path": null,
      "status": "pending",
      "task_ids": [
        "task.docs.instructor.sync"
      ],
      "source_ids": [
        "docs.instructor"
      ],
      "updated": 0,
      "translated": 0,
      "translation_links": [],
      "errors": []
    },
    {
      "module_id": "docs.jarvis-registry",
      "name": "Jarvis Registry",
      "kind": "source",
      "enabled": true,
      "target_path": null,
      "status": "pending",
      "task_ids": [
        "task.docs.jarvis-registry.sync"
      ],
      "source_ids": [
        "docs.jarvis-registry"
      ],
      "updated": 0,
      "translated": 0,
      "translation_links": [],
      "errors": []
    },
    {
      "module_id": "docs.langchain",
      "name": "LangChain Docs",
      "kind": "source",
      "enabled": true,
      "target_path": null,
      "status": "pending",
      "task_ids": [
        "task.docs.langchain.sync"
      ],
      "source_ids": [
        "docs.langchain"
      ],
      "updated": 0,
      "translated": 0,
      "translation_links": [],
      "errors": []
    },
    {
      "module_id": "docs.langfuse",
      "name": "Langfuse",
      "kind": "source",
      "enabled": true,
      "target_path": null,
      "status": "pending",
      "task_ids": [
        "task.docs.langfuse.sync"
      ],
      "source_ids": [
        "docs.langfuse"
      ],
      "updated": 0,
      "translated": 0,
      "translation_links": [],
      "errors": []
    },
    {
      "module_id": "docs.langsmith",
      "name": "LangSmith",
      "kind": "source",
      "enabled": true,
      "target_path": null,
      "status": "pending",
      "task_ids": [
        "task.docs.langsmith.sync"
      ],
      "source_ids": [
        "docs.langsmith"
      ],
      "updated": 0,
      "translated": 0,
      "translation_links": [],
      "errors": []
    },
    {
      "module_id": "docs.letta",
      "name": "Letta",
      "kind": "source",
      "enabled": true,
      "target_path": null,
      "status": "pending",
      "task_ids": [
        "task.docs.letta.sync"
      ],
      "source_ids": [
        "docs.letta"
      ],
      "updated": 0,
      "translated": 0,
      "translation_links": [],
      "errors": []
    },
    {
      "module_id": "docs.llamaindex",
      "name": "LlamaIndex",
      "kind": "source",
      "enabled": true,
      "target_path": null,
      "status": "pending",
      "task_ids": [
        "task.docs.llamaindex.sync"
      ],
      "source_ids": [
        "docs.llamaindex"
      ],
      "updated": 0,
      "translated": 0,
      "translation_links": [],
      "errors": []
    },
    {
      "module_id": "docs.mem0",
      "name": "mem0",
      "kind": "source",
      "enabled": true,
      "target_path": null,
      "status": "pending",
      "task_ids": [